{
  "aggregates": {
    "ai_provider_count": 1,
    "eu_hosted_count": 1,
    "non_eu_count": 1,
    "sovereign_count": 1,
    "total_providers": 2
  },
  "artifact_id": "af92ee7bd2df0808bd9579e0cf9691925555828c6ee6bae737625658e8754a69",
  "captured_at": "2026-06-07T06:00:00Z",
  "control_refs": [
    "control.supplier_inventory@v1",
    "control.provider_attestation@v1"
  ],
  "dependencies": [
    {
      "attestation": {
        "attestation_ref": "atte-2026Q2-0001",
        "last_reattested_at": "2026-04-01T00:00:00Z",
        "next_due_at": "2027-04-01T00:00:00Z",
        "state": "effective"
      },
      "call_count": 4,
      "kind": "data_feed",
      "provider_id": "provider.cve_feed_eu@v1",
      "risk_notes": "Primary vulnerability-data source for triage enrichment in the vuln_intake worked example.",
      "sovereignty_classification": {
        "band_rationale": "EU-owned vulnerability data feed operating wholly inside an EU Member State; no declared sub-processors.",
        "kb_ref": "supplier-kb://provider-eu-sovereign-cve/2026-Q2",
        "ownership": "eu_owned",
        "residency": "eu",
        "sovereignty_band": "sovereign",
        "sub_processor_chain": []
      },
      "version": "2026-06-07"
    },
    {
      "attestation": {
        "last_reattested_at": "2025-01-01T00:00:00Z",
        "next_due_at": "2026-01-01T00:00:00Z",
        "state": "overdue"
      },
      "call_count": 1,
      "kind": "ai_provider",
      "provider_id": "provider.llm_inference_non_eu@v1",
      "risk_notes": "Surfaced as overdue per supplier-KB cadence; the vuln_intake playbook can degrade gracefully to non-AI risk summarisation.",
      "sovereignty_classification": {
        "band_rationale": "Non-EU LLM used for the optional risk-summary generation branch; ownership chain not in scope for the sovereign band.",
        "kb_ref": "supplier-kb://provider-non-eu-llm/2026-Q2",
        "ownership": "non_eu_owned",
        "residency": "non_eu",
        "sovereignty_band": "non_eu"
      }
    }
  ],
  "execution_id": "temporal:vuln_intake_example_0001",
  "owner": {
    "assigned_at": "2026-01-15",
    "role": "supplier-governance@example.org"
  },
  "provenance": {
    "captured_at": "2026-06-07T06:00:00Z",
    "source_url": "https://example.org/runs/vuln_intake_example_0001"
  },
  "regulation_refs": [
    "nis2:art-21-2-d",
    "nis2:art-22"
  ],
  "schema_version": "1.0.0",
  "stream": "supply-chain",
  "workflow_id": "vulnerability_triage"
}
